{
  "schema_version": "creative-concepts.v1",
  "generated_at": "2026-07-18T04:23:15Z",
  "benchmark_id": "morning-routine-7-clips-v1",
  "footage_summary": "The footage visibly covers a person under a blanket and getting up, moving around a bedroom, presenting and tying a sneaker, using two inside-refrigerator camera setups, eating from a bowl and waving, and traveling through an indoor hallway on an electric scooter. Calling it a morning routine is a creative interpretation supported by the actions, not by recorded clock time or verified dialogue.",
  "concepts": [
    {
      "concept_id": "concept_chronological_routine",
      "title": "Out the Door in 31 Seconds",
      "topic": "A compact visual morning routine from waking up to leaving the building.",
      "audience": "Reels and TikTok viewers who enjoy concise daily-life and routine montages.",
      "platforms": [
        "instagram_reel",
        "tiktok"
      ],
      "target_duration_seconds": 31,
      "hook": "Open on the friendly food-and-wave moment with the text “A whole morning in 31 seconds,” then cut back to the blanket.",
      "structure": [
        {
          "beat_id": "hook_wave",
          "purpose": "Start with eye contact and a human gesture before the chronological reset.",
          "target_duration_seconds": 2,
          "evidence": [
            {
              "asset_id": "img_0997",
              "start_seconds": 1.45,
              "end_seconds": 3.305,
              "observed_content": "The person looks toward the camera and waves while holding a bowl.",
              "confidence": 0.99
            }
          ]
        },
        {
          "beat_id": "wake",
          "purpose": "Establish the start of the routine with a clear physical reveal from under the blanket.",
          "target_duration_seconds": 4.5,
          "evidence": [
            {
              "asset_id": "img_0994",
              "start_seconds": 4.8,
              "end_seconds": 9.3,
              "observed_content": "The person lies on a pillow and reveals their face from beneath the blanket.",
              "confidence": 0.97
            }
          ]
        },
        {
          "beat_id": "bedroom_reset",
          "purpose": "Move from waking to being upright and getting ready in the room.",
          "target_duration_seconds": 3.5,
          "evidence": [
            {
              "asset_id": "img_0995",
              "start_seconds": 3.5,
              "end_seconds": 7.0,
              "observed_content": "In a locked wide shot, the person walks near the bunk bed and touches their face.",
              "confidence": 0.95
            }
          ]
        },
        {
          "beat_id": "shoes",
          "purpose": "Show preparation through an object reveal and a compressed completion of the lacing action.",
          "target_duration_seconds": 7,
          "evidence": [
            {
              "asset_id": "img_0996",
              "start_seconds": 8.5,
              "end_seconds": 11.3,
              "observed_content": "The seated person brings a sneaker up toward the camera.",
              "confidence": 0.96
            },
            {
              "asset_id": "img_0996",
              "start_seconds": 53.0,
              "end_seconds": 57.2,
              "observed_content": "The person finishes tightening the shoe and begins to rise.",
              "confidence": 0.95
            }
          ]
        },
        {
          "beat_id": "food",
          "purpose": "Connect getting ready to a quick breakfast beat using action and payoff.",
          "target_duration_seconds": 5,
          "evidence": [
            {
              "asset_id": "img_0991",
              "start_seconds": 15.4,
              "end_seconds": 18.8,
              "observed_content": "From the inside-fridge viewpoint, the person leans in and reaches toward the shelf.",
              "confidence": 0.96
            },
            {
              "asset_id": "img_0997",
              "start_seconds": 0.0,
              "end_seconds": 1.45,
              "observed_content": "The person eats from a bowl with a spoon.",
              "confidence": 0.99
            }
          ]
        },
        {
          "beat_id": "leave",
          "purpose": "End with forward motion and a clear transport reveal.",
          "target_duration_seconds": 9,
          "evidence": [
            {
              "asset_id": "img_0999",
              "start_seconds": 1.0,
              "end_seconds": 8.5,
              "observed_content": "The backpacked person records a moving scooter selfie through an indoor hallway.",
              "confidence": 0.98
            },
            {
              "asset_id": "img_0999",
              "start_seconds": 15.0,
              "end_seconds": 15.8,
              "observed_content": "The camera tilts down to reveal the scooter near elevator doors.",
              "confidence": 0.98
            }
          ]
        }
      ],
      "strengths": [
        "The footage contains a complete, understandable action arc.",
        "The inside-fridge, wide-bedroom, and moving-selfie angles create visual variety.",
        "The concept works without dialogue or generated footage."
      ],
      "weaknesses": [
        "There is no exterior or destination shot, so the ending proves departure but not arrival.",
        "IMG_0994 requires a 90-degree orientation correction and a manually checked vertical crop.",
        "Clothing changes across clips may make strict chronological continuity feel staged."
      ],
      "missing_shots": [
        {
          "purpose": "Give the departure a stronger final payoff.",
          "recording_instruction": "Record a 3–4 second locked vertical shot outside the building: enter frame with the backpack and scooter, pass the camera, and leave frame with at least one second of empty hold.",
          "priority": "recommended",
          "fallback": "End on IMG_0999 at 15.0–15.8 with the downward scooter reveal and a short title card."
        },
        {
          "purpose": "Add clean rhythmic sound accents.",
          "recording_instruction": "Record isolated natural sounds for blanket movement, refrigerator close, lace pull, and scooter start, each with two seconds of room tone before and after.",
          "priority": "optional",
          "fallback": "Use the corresponding source audio quietly under music after checking the near-clipping assets."
        }
      ]
    },
    {
      "concept_id": "concept_comedy_friction",
      "title": "My Five-Minute Routine Somehow Takes Forever",
      "topic": "A self-aware comedy about tiny morning tasks expanding into a whole production.",
      "audience": "Viewers who relate to procrastination, slow starts, and lightly edited everyday comedy.",
      "platforms": [
        "instagram_reel",
        "tiktok"
      ],
      "target_duration_seconds": 27,
      "hook": "Text over the blanket shot: “Me: I’ll be ready in five minutes.” Use increasingly impatient step labels as the routine repeats.",
      "structure": [
        {
          "beat_id": "promise",
          "purpose": "Set up the comic promise with a visibly slow start.",
          "target_duration_seconds": 4.2,
          "evidence": [
            {
              "asset_id": "img_0994",
              "start_seconds": 4.8,
              "end_seconds": 9.0,
              "observed_content": "The person remains in bed and slowly reveals their face from the blanket.",
              "confidence": 0.97
            }
          ]
        },
        {
          "beat_id": "fridge_loop",
          "purpose": "Turn two similar refrigerator takes into a deliberate repeated-attempt joke.",
          "target_duration_seconds": 6,
          "evidence": [
            {
              "asset_id": "img_0991",
              "start_seconds": 11.1,
              "end_seconds": 15.4,
              "observed_content": "The refrigerator view goes dark and then bright as the door closes and reopens.",
              "confidence": 0.98
            },
            {
              "asset_id": "img_0993",
              "start_seconds": 13.0,
              "end_seconds": 15.6,
              "observed_content": "A second take repeats the bright-to-dark-to-bright refrigerator-door action.",
              "confidence": 0.98
            }
          ]
        },
        {
          "beat_id": "endless_laces",
          "purpose": "Compress the long repetitive shoe-lacing footage into escalating jump cuts.",
          "target_duration_seconds": 7.5,
          "evidence": [
            {
              "asset_id": "img_0996",
              "start_seconds": 12.0,
              "end_seconds": 14.0,
              "observed_content": "The person begins working the sneaker laces.",
              "confidence": 0.99
            },
            {
              "asset_id": "img_0996",
              "start_seconds": 27.0,
              "end_seconds": 29.0,
              "observed_content": "The same static setup continues with another lace pull.",
              "confidence": 0.99
            },
            {
              "asset_id": "img_0996",
              "start_seconds": 43.0,
              "end_seconds": 45.0,
              "observed_content": "The person is still tightening the sneaker laces.",
              "confidence": 0.99
            },
            {
              "asset_id": "img_0996",
              "start_seconds": 54.0,
              "end_seconds": 56.0,
              "observed_content": "The shoe task finally approaches completion.",
              "confidence": 0.97
            }
          ]
        },
        {
          "beat_id": "caught_snacking",
          "purpose": "Use the direct wave as an acknowledgment that the routine has wandered off course.",
          "target_duration_seconds": 2,
          "evidence": [
            {
              "asset_id": "img_0997",
              "start_seconds": 1.45,